{"$schema":"https://json-schema.org/draft/2020-12/schema","$id":"https://schemas.rotprods.dev/clever/v1/capability.schema.json","type":"object","additionalProperties":false,"required":["contractVersion","capabilityId","family","name","owner","interfaceContract","interfaceVersion","lifecycleMode","rollbackSupported"],"properties":{"contractVersion":{"$ref":"https://schemas.rotprods.dev/clever/v1/common.schema.json#/$defs/contractVersion"},"capabilityId":{"type":"string","minLength":1},"family":{"type":"string","minLength":1},"name":{"type":"string","minLength":1},"owner":{"$ref":"https://schemas.rotprods.dev/clever/v1/common.schema.json#/$defs/runtimeOwner"},"implementationVersion":{"type":"string"},"interfaceContract":{"type":"string","minLength":1},"interfaceVersion":{"type":"string","minLength":1},"lifecycleMode":{"type":"string","enum":["LIFECYCLE_MODE_EPHEMERAL","LIFECYCLE_MODE_SESSION","LIFECYCLE_MODE_PERSISTENT","LIFECYCLE_MODE_DEVICE"]},"permissions":{"type":"array","items":{"type":"object","additionalProperties":false,"required":["permission","scope","mandatory"],"properties":{"permission":{"type":"string","minLength":1},"scope":{"type":"string"},"mandatory":{"type":"boolean"}}}},"stateEffects":{"type":"array","items":{"type":"string"}},"sideEffects":{"type":"array","items":{"type":"string"}},"platformConstraints":{"type":"array","items":{"$ref":"https://schemas.rotprods.dev/clever/v1/common.schema.json#/$defs/platformConstraint"}},"rollbackSupported":{"type":"boolean"},"provenance":{"type":"array","items":{"$ref":"https://schemas.rotprods.dev/clever/v1/common.schema.json#/$defs/provenanceRef"}},"evidence":{"type":"array","items":{"$ref":"https://schemas.rotprods.dev/clever/v1/common.schema.json#/$defs/evidenceRef"}},"extensionMetadata":{"type":"object","additionalProperties":{"type":"string"}}}}
