{"contractVersion":{"major":1,"minor":0},"capabilityId":"voice.ptt.transcribe","family":"speech_audio","name":"Push-to-talk transcription","owner":{"runtimeId":"clicky-macos","adapterId":"clicky","deviceId":"mac_demo"},"implementationVersion":"upstream-pinned","interfaceContract":"clever.v1.speech.transcribe","interfaceVersion":"1.0","lifecycleMode":"LIFECYCLE_MODE_DEVICE","permissions":[{"permission":"microphone","scope":"device:mac_demo","mandatory":true}],"stateEffects":[],"sideEffects":[],"platformConstraints":[{"platform":"macos","requiredFeatures":["microphone"]}],"rollbackSupported":false,"evidence":[{"evidenceId":"EVID-DEMO"}],"extensionMetadata":{"native":"true"}}
